<?xml version="1.0" encoding="UTF-8"?>

<lista_operazioni xmlns:xsi="http://www.w3.org/2001/XMLSchema-instance"
xsi:noNamespaceSchemaLocation="operazioni.xsd">

<operazione id_operazione="1" username_bytecourier="" id_ordine="1" stato="1">
    <note></note>
</operazione>

<operazione id_operazione="2" username_bytecourier="Wick64" id_ordine="2" stato="4">
    <note>
        <nota data_nota="2022-09-14T09:30:00" username="Wick64">
            Il ritiro Ã¨ proceduto secondo i piani
        </nota>
    </note>
</operazione>

<operazione id_operazione="3" username_bytecourier="" id_ordine="3" stato="2">
    <note></note>
</operazione>

<operazione id_operazione="4" username_bytecourier="" id_ordine="4" stato="3">
    <note></note>
</operazione>

<operazione id_operazione="5" username_bytecourier="" id_ordine="5" stato="1">
    <note></note>
</operazione>

<operazione id_operazione="6" username_bytecourier="Wick64" id_ordine="6" stato="5">
    <note></note>
</operazione>

<operazione id_operazione="7" username_bytecourier="Wick64" id_ordine="7" stato="1">
    <note></note>
</operazione>

</lista_operazioni>